{
  "answer_id": "ans-demo-001",
  "question": "演示车辆记录是否需要包含检查日期？",
  "short_answer": "需要。这个 synthetic 示例要求记录包含检查日期。",
  "scope": {
    "jurisdiction": "EX",
    "document_id": "doc-demo-vehicle-safety",
    "date": "2026-05-27"
  },
  "citations": [
    {
      "provision_id": "prov-demo-001",
      "source_id": "src-demo-001",
      "locator": "section 1.1",
      "quote_policy": "synthetic_public_ok"
    }
  ],
  "conditions": [],
  "exceptions": [],
  "version_safety": "current",
  "confidence": "high",
  "unresolved_issues": []
}
